text,emotion
have you had no withdrawal symptoms did you quit cold turkey i want to go off abilify it sucks,anger
people are gonna end up hating deus ex because of this and thats just a travesty,anger
My teacher's strict grading system for essays makes me feel immense strain to choose every single word perfectly.,pressure
watching family movies always makes me a bit nervous that there will suddenly be a cut away to my parents having an intimate moment,fear
this lady argued with me for wanting a guard on the side for my fade walked out,self_doubt
are your boys really doing the hand clap meme holy crap is this cringey,anger
kansas st is trending nationwide too bad they didnt win,sadness
yeh its pretty obvious how i misread it bc i misread it i didnt downvote you,self_doubt
i cannot imagine being so fragile that being able to smile threatens your identity and world view,anger
when youre too stupid to realize they showed off character customization in the trailer,self_doubt
too many of us are not living our dreams because we are living our fears les brown fact,fear
"She always has such perfect hair, while mine is always a mess, making me feel a bit less put-together.",comparison
"My little brother always seems to get away with more than I ever did at his age, which feels a bit unfair.",comparison
"The family gatherings often turn into discussions about my college prospects, making me feel on the spot.",pressure
bob became embarrassed at his own effusiveness and turned back to the screen tapping out the rhythm with his fingers on the side of his glass,self_doubt
nobody told me that before,fear
this joke has been on here a million times and never ceases to trick me,self_doubt
learsi osomref ed rt gag dread it run from it destiny arrives all the same,fear
"I'm tutoring a younger student, and the responsibility to help them succeed adds another layer of expectation to my week.",pressure
why does knowing that is inevitably part of the process of any kind of creative or personal growth not exempt you from feeling it,fear
Seeing how many followers Jessica has on social media compared to my few makes me feel less popular and a bit sad.,comparison
varan ed biggest surprise from bandai spirits ngl,confusion
that book would be the biggest flop the characters and plot are really too outrageous to be believable,anger
confused and triggered,confusion
"My simple backpack looks plain next to everyone's trendy, expensive bags, making me feel a little less cool.",comparison
good stay the fuck away,anger
yeah i love the shenanigans he gets up to shame he hasnt been able to get up to much recently though,self_doubt
what the actual fuck,anger
"Our school newspaper has a tight publishing schedule, and getting all my articles in on time is a constant battle.",pressure
i was accused of a misdemeanour unjustly,anger
"I compare my small allowance to what some of my friends receive, and it makes me wish I had more spending money.",comparison
losing my girlfriend who made an end to our relationship by this i lost an important source of support certainty and joyful moments i cried very intensly when that happened,sadness
The other kids in the band play their instruments so confidently; I still get nervous during solos.,comparison
"My school lunch is always the same, while other kids bring incredibly diverse and delicious meals from home.",comparison
My band director's strict expectations for our upcoming performance have me practicing until my fingers ache and my head spins.,pressure
The other swimmers in my lane glide through the water so effortlessly; I feel like I'm working much harder.,comparison
My attempts at baking cookies never turn out as perfectly round and golden brown as Mom's do.,comparison
studid fuckin idiot,anger
"I have to secure a strong recommendation letter, and the pressure to impress my teachers enough to write a glowing one is significant.",pressure
lucaslucashot after that day the house was never the same until today when i pass in front of the house i cross the street haha,fear
on this occasion satygraha involved imprisonment of thousands of indians much to the embarrassment of the union government of south africa,self_doubt
ive started watching i now think being a moral con artist could be a viable backup career secret is people are greedy,confusion
im sure youve been accosted many times by the cops or as i call them name fash squad,self_doubt
tinaschicchi you make me want to dye my hair dark but im going even blonder tomorrow,confusion
its an unfortunate situation but it had to be done at some point,fear
oh that scared me,fear
when i and the person mentioned above had a suspicion of pregnancy,fear
Seeing how easily my friend solves complex math problems makes me feel a bit frustrated with my own struggles.,comparison
what an idiot,anger
im sensitive,sadness
lol im just fucking around i can wait,anger
what a boring ugly day this is taking quotlazy sundayquot to an extreme the worst part is that you are far away,sadness
srs that shade range is abysmal smh,self_doubt
especially mean im with you i like the funny posts but people use social media as an excuse to just be horrible people,anger
cinders not going to be there when name fights name shes getting the relic name has the relic,anger
"Juggling homework, sports practice, and my part-time job leaves me feeling constantly stretched and pushed to my limits.",pressure
"He always gets the lead role in school productions, and I feel like I'm always just part of the background chorus.",comparison
"My little sister's room is always spotless, unlike my own, which often looks like a tornado just passed through it.",comparison
ahh damn gotta pay attention to that never even knew,anger
My confidence wavers when I compare my public speaking skills to the eloquent presentations of my classmates.,comparison
one day i went to the cinema to see a film in which i was interested on arriving there i saw a long queue which i had not expected and went back home without seeing the film,fear
im in my second year still closeted still uncomfortable with my body and sexuality still socially awkward,self_doubt
"My new shoes are pretty cool, but they don't light up or have fancy wheels like some of the other kids' sneakers do.",comparison
man these fourth quarters the nets are on some name shit it just seems mental now,anger
just to follow the crowdjakobolsen i have had a crush on you since sophomore year la happy birthday,confusion
the trouble today with women the mouth dont stop,fear
"Their house has a swimming pool, making our small backyard seem boring in comparison.",comparison
dilal ed rt gag dread it run from it destiny arrives all the same,fear
how are they assholes,anger
i dated a girl once who made a gb with her cup holder dropped my phone in it once,self_doubt
I think my voice isn't as strong or clear as the lead singer in the school choir; she sounds amazing.,comparison
i mean maybe i did too but as you said it was a decade ago or more,confusion
right because name was a circumcized name who died for our sins,self_doubt
The new girl in class already seems to know more people and fit in better than I did when I first started here.,comparison
bangmaryam i think u miss bangmir oppai miss my navigator ferdinandhitz oppacoz today he not living some twitt,sadness
tomthebomb dunstnasty snipinbetts veenstar drifting the shit out of fort mall parking lot,sadness
"My coding club project has to be innovative and bug-free for the upcoming showcase, a daunting expectation.",pressure
Their family Christmas decorations always look much more elaborate and magical than our humble display.,comparison
yeah transgenders are stupid,anger
the awkward moment people stare at you cause you look funny im warm and your freezing your ass off whoslaughingnow,confusion
i wasnt even expecting the reply thats why im literally bamboozled,self_doubt
just like you cant underestimate the capacity for evil you cant underestimate the capacity for stupidity,self_doubt
wishing i could be relaxing and doing fun things like all my friends but im working on a paper in gracies ihavenolife,confusion
you are building walls and afraid to open up stepforward,fear
I wish my parents would let me have as much freedom as her parents allow her; she gets to do everything.,comparison
I noticed that Maria's birthday cake had way more layers and elaborate decorations than the simple one I had last year.,comparison
fuuuuck i am so angry that this can even happen,anger
"I have to perform well for my teachers, follow rules for my parents, and fit in with my friends, it's exhausting.",pressure
try painting a penis around the pothole seems to have worked in manchester,anger
kingspare that has to be the worst mrs mcintyre made me clean her room to go,sadness
women are more neurotic,self_doubt
thefpshow yea i doubt you could come to new york too many antigun laws,sadness
"I have three big assignments due next week, and the thought of completing them all perfectly is creating a huge amount of pressure.",pressure
is it a lack of or a of loneliness that make people put up with bullshit,fear
he was so apologetic the bulls couldnt bring themselves to it,self_doubt
"The scholarship interview is next week, and the knowledge that my future depends on it fills me with intense pressure.",pressure
the sources said he is infuriated with her after a row that erupted last week and is likely to distance himself from her,anger
i am very grateful for your advice,anger
my parents thought that i didnt do my best to pass the final examination secondary school when i achieved a good grade they said nothing but if i had had a bad grade they would have become very angry,anger
commentator hasnt picked up on giggs second time throwing someone to the floor,confusion
seeing name score on them was unbelievable how embarrassing,self_doubt
oh gosh oh frick,confusion
dude who knows u cant tell what a chemical is based on taste,confusion
"My classmates grasp new concepts in science much faster than I do, leaving me behind.",comparison
almost every single time i have a friend from out of state visit they make a comment about how bumpy our roads are,self_doubt
visto un video spoiler di dove santana fa comingout con la nonna dico solo tante lacrime,sadness
"It's a bit hard when my younger sister gets praised for her neat room, while mine often looks like a tornado just passed through.",comparison
nope whats it about,confusion
there is danger in traditional quotpaperquot media calling electronic media youtube blogger etc quotnot realquot censorship corporategreed,fear
oh my god who in the world eats their cracker without its shell simply disgusting didnt even had to ask smh,confusion
I felt a boost of confidence when I saw my test score was higher than most of the class average.,comparison
"When I compare my slow running speed to my athletic peers, I feel a desire to train harder and improve significantly.",comparison
rpayne shutzefrontdoor ze are on why arent you here we can meet in dc and then i can hop in ze trunk for the family,confusion
"All my friends have gone to multiple concerts this year, and I haven't been to a single one yet, which makes me feel left out.",comparison
great day love when my car gets hit,anger
can confirm my downvote was removed added it back just now edit my mistake it was a different video,self_doubt
the could be more than just a sport i am now viewing this as a perfect example for practising replacement of,anger
i am convinced that the nice ones are traps they lure you in with the promise of granite counters then you wake up without a kidney,fear
"I feel like my voice isn't as strong as the other choir members, making me nervous to sing out.",comparison
im so uncomfortable,self_doubt
Everyone else seems to be better at memorizing facts for history class than I am; I always mix things up.,comparison
cant find an online rental for jurassic park anywhere and our vhs is fed up today a tradition may get ruined,sadness
"All my classmates have cool phone cases, but mine is just a clear one, which makes it seem less personalized.",comparison
you follow me i follow u i dnt play that u follow me i wait till u tell me to followback naw im unfollow me i unfollow u,fear
belnesba lwazeer el dakhlya baa isa da eh wala eh,confusion
pritishnandy kapil sibal ji digvijaya singh aur manish tewari bole to sab rangila haitwitterfacebook bole to character dhila hai,anger
sendei was nt ashamed to show his fear,self_doubt
the day my teacher of latin and french died,sadness
I felt a pang of envy seeing my friend get a new puppy; I wish my parents would let me have one too.,comparison
my bad thought it was the english one,self_doubt
primadonnalala i wanna preorder rapture but i dont have any mad obsessed nice tags,sadness
"There’s a constant self-imposed task of being the ""smartest"" in the room, making every intellectual challenge feel intense.",pressure
"If I don't improve my grades, I might not get my phone back, and that looming threat feels like a constant weight.",pressure
i forget it all the time too,self_doubt
"Her room has a walk-in closet, which is way bigger than my small, regular closet.",comparison
it sucks for us marist kids taking exams tomorrow its not like we do this every year,confusion
fucking pouliot youre shit,anger
which was a curious sensation since in fact her eyes were downcast apparently studying the vinyl squares of the floor,sadness
good thing i never called him a journalist and wrote multiple sentences about how his comedian instincts make his interview show bad,self_doubt
aimeetweetsu quotthe of the lord is revealed from heavenquothelps us understand gods righteousness he hates sinamp loves sinners us,anger
because hes attractive hence name come out in droves to defend him despite the fact hes a horrid asshole,anger
mattmosley this is the shakiest point lead in history of college football lol,fear
jaywardiv did succeed with pizza rolls last night,confusion
I always notice how much more organized Clara's desk is compared to my own pile of scattered papers and forgotten pens.,comparison
its starting to get weird,self_doubt
though underwear would have made this less embarrassing i wear it for a different reason,self_doubt
"It's hard not to compare my allowance to my friends', who seem to get so much more money.",comparison
you know you have no life when you have tabs open and they are twitter facebook and tumblr,sadness
feels weird when something that wasnt bad but not the best back then is now incredibly overrated,self_doubt
what a great day got to see most of my favorite people i am so thankful to have great friends happy,confusion
managing negative emotions can be tough and can be managed effectively with the use of hypnosis,sadness
"It's hard not to compare my family's financial situation to my wealthy friends', who seem to have everything.",comparison
begz ah stop im heading with cousins ive vip seats in old trafford sorted theyre all mad for the beer and the shakes await,fear
at least he was polite please fuck off,anger
"My mom wants me to learn a new language, adding another demanding task to my already overflowing schedule.",pressure
getting sick during the night while having a beautiful sleep sucks ass,sadness
gt lol wowomg iamtpc fuck grambling i bet yall girls pussys stank,anger
mom got me organic glutenfree vegan chips and theyre actually amazing healthybinge,confusion
when my grandfather whom i had met only once for weeks died after several months i was really sad because he was a lovely person and i did not have the means for his company,sadness
"I wish I could articulate my thoughts as clearly as my friends do in class discussions, feeling a bit tongue-tied.",comparison
"There's an internal pressure to always be productive, never wasting a moment, making me feel guilty when I try to relax.",pressure
sumtimes d fear of being jobless after school gives me the creeps of an undergraduate,fear
and the moral of the story is never trust a minivans reliability on black friday or any day cartrouble,sadness
dum maaro dum movies slick scandalous cool and hardly embarrased of the fact that it aspires to be so,confusion
karma what a great example for us all sir,sadness
zijn naar school gauw lijm schaar paper en karton tevoorschijn even druk met mn drukdrukdruk,confusion
I wish my clothes were as fashionable and up-to-date as what the cooler kids at school wear every day.,comparison
Watching him effortlessly perform that skateboard trick made my own attempts look clumsy and uncoordinated.,comparison
yes ive had this fear its even worse when you dont say goodbye and then its the last time you see them,fear
nick just officially left for tennessee,sadness
i got that feeling as well hoping he retires a jet we are the one org that embraced him he was coaching sam every step,self_doubt
shouldnt be getting downvoted thats exactly what i thought the motive was,self_doubt
he sifted somewhat peeved through the remaining unopened mail,anger
survival of the toughest,self_doubt
yeah i always thought name would be an improved name its a damn shame we havent thrown to him more often,self_doubt
things that never get better with time putting the cover on your duvet,anger
"The thought of all the summer assignments piling up already gives me this tight, anxious feeling in my chest.",pressure
farewell goodbye so long,fear
oh my god i just got an intense craving for knockout wings smh mrbdholmes cstrapp therap,sadness
i dont mind those who disagree with marijuana legalization i do mind when their arguments are not based in fact,fear
atwima hitzlesberger ed ghkelous i shock for you o if me i get that vim like i be millionaire by now,confusion
strcam had an arrangement wmy brother go south i was supposed to end up getting a tablet an thats not happening anymore lol,confusion
that last bit is part of the embarrassment actually,self_doubt
i wish harry potter was never ending,sadness
my hair almost got stuck in the door this morning time for a hair cut maybe,sadness
i think people who get up in a dizzy over an add that shames bullying and sexual harassment are probably special snowflakes,self_doubt
a colleague asked me to study with her i could not explain things as perfectly as she had expected so she reacted in an aggressive manner,anger
I feel like my ideas for projects are never as original or exciting as others' contributions.,comparison
"The annual art competition requires me to create a masterpiece, and I feel immense pressure to produce something truly original and breathtaking.",pressure
dont ever be ashamed of who you are,self_doubt
tero followed them at a distance watching her new friend with sorrowful anxious eyes,fear
"I feel like I'm constantly chasing an unreachable ideal, always striving for more, and it's making me exhausted.",pressure
name arent a race either are you trying to be ignorant,confusion
feels like im wearing nothing at all,self_doubt
"My parents frequently discuss my academic future, making me feel a continuous pressure to perform exceptionally in every single subject.",pressure
i think call before you come and limit it to an hour is reasonable if you have relatives that need to be told that,anger
namjoon is the only man ed rt astrologihoe aries virgo scorpio capricorn asking for,fear
johnnorlin tells us that weve sacrificed more than others tells us its time worry about the future xaxaluke,fear
Seeing all the popular kids hang out together makes me feel like my small group of friends isn't as important.,comparison
music was better when name beat his wife,self_doubt
this sub is very very bad at irony,self_doubt
It’s tough to feel smart when I compare my test scores to the highest marks in the class and fall short.,comparison
deactivated the account from my device no longer tweeting for the program it really is over,sadness
this may be overreacting but i would not touch those presents there could be a bomb in them,self_doubt
i know what you mean maam said rose gravely enjoying himself immensely at the sight of auguste s embarrassed face,self_doubt
they said name struggled but he made the all rookie team this guy clearly didnt go very in depth,anger
one day when riding on a bicycle path a car coming from the opposite direction forced me to get off my bike although i had the priority,anger
scottmargetson you look like your living in you should be after that voice note you sent me oohnononono,fear
i was waiting to receive the participation on the profits and did not receive it,anger
ruin and set back race relations,sadness
Keeping up with the latest trends and having the coolest gear from popular brands puts significant social pressure on me daily.,pressure
eurheartout brandinoelle i havent told anyone the color yet gonna twipic tomorrow its for job tho gonna go back black asap,confusion
i remember my nextel would play her ringer amp id start sweating lol getrchordieasap know what im talkin bout lol,fear
"The school newspaper deadline is looming, and the pressure to write a compelling article that satisfies the editor is intense.",pressure
falling on stage tonight gunna pretend to plank if it happens aebaer thanks for the advice,fear
she jumped up frowning in dismay,fear
"I really need to get a good score on this math test to pass the class, and the numbers on the page seem to mock me.",pressure
quotrevrunwisdom not afraid of tomorrow for i have seen yesterday and i love today lessquot,fear
what a cool argument dude lol this coming from the worlds most empowered dater who can date anyone stop age shaming,anger
ive had such bad memories i remember when i remember bad times now haha,self_doubt
im about to eat taco bell for the first time in over years,fear
why make it a video could have just been a text post,anger
well you always say youre busy,sadness
i love when you think up the best christmas gift aebee sorrynotsorry,confusion
It's hard not to compare my struggle with public speaking to Maria's confident and articulate presentations in front of the class.,comparison
well i just cut jay cutler from my fantasy team,sadness
taheb s face became sad,sadness
because the other option is labour and they are treacherous,sadness
obviously he was not going to speak and jenna was embarrassed at being caught here more embarrassed still at the idea of walking haughtily to her room without a word,self_doubt
"Everyone else in my class has fancy new sneakers, and I'm still wearing last year's worn-out pair to school every day.",comparison
"My best friend easily got into the advanced class, and I just barely made it into the regular one.",comparison
i kno is legal yall niggas but if u ova wht can a lil broad dat live home really do u but wet ya dick vonhawk,sadness
i dare each or any of you fuckasses to try and blame name for this one,self_doubt
Finishing all my assigned readings before class discussion feels impossible when balancing other schoolwork and activities.,pressure
man you take your sims really seriously,anger
of course it bothers you she just admitted that something inconsequential to your relationship would be a dealbreaker,sadness
midnight has been pro league teams they have played so far so i wouldnt be too sure theyre gonna be bottom feeders,confusion
i was so embarrassed said dave,self_doubt
I wish my parents would let me stay up as late as my best friend's parents allow them to on weekends.,comparison
I feel a quiet sense of competition when I see my peers' scores on the leaderboard in my favorite video game.,comparison
josop ed rt cenvall en reyconbarba en el lum mal orientan a estudiantes pintando a las ffaa como abusivos victimarios y arma del terror del esta,fear
i dunno you commit one little genocide and you never hear the fucking end of it,sadness
eyewitnesses told of the horror as shrapnel rained down on shoppers from two devices placed in castlitter bins less than ten yards apart,fear
they were criticizing your spelling,anger
I feel a bit inadequate when I compare my school projects to the more professional and polished work of my peers.,comparison
no really strong such emotion just falling off to sleep when i caught sight of a cm diameter spider crawling onto the pillow beside me,fear
not even if i worked there would i attend her meet and greet,confusion
it should have been irresistible and yet we hesitated embarrassed at having taken so long,self_doubt
the rebel serbs were miffed that bildt planned no trip to their stronghold of pale east of sarajevo,anger
lmao i didnt realize that error,sadness
"Their family always has the coolest holiday decorations, making our house look a bit bland.",comparison
"There's a strong social expectation to always have plans on the weekend, making me feel pressured to constantly be busy.",pressure
The weight of my own ambition to succeed in everything I attempt is often incredibly difficult to bear.,pressure
teen mom last night was disspointing same bs w jenelle,confusion
"The deadline for submitting my scholarship application is tomorrow, and I'm feeling the crushing pressure to complete it perfectly and on time.",pressure
name has so many people shook,self_doubt
weird it always makes me horny,confusion
had a fun daynight with masontheswamper and his family happy birthday blake,confusion
right the hypocrisy with the name situation is staggering,confusion
her meagre shilling donation was an embarrassment in this wealthy company but she refused to think of it,self_doubt
the middle finger emoji are you kidding,confusion
folks its shop till u drop amp them wait the at the end of the month bills shop wisely,confusion
when anybody wants to make me feel guilty for example i should do something for my mother but things didnt go as she hoped then she threatens ill do it myself,anger
"Their house has a huge backyard with a trampoline, and we only have a small patio.",comparison
is less user friendly but it can be fun as long as you turn chat off and hate yourself already,self_doubt
