text,emotion
"My siblings achieved so much in high school, and I feel an immense pressure to match their accomplishments and even surpass them.",pressure
I wish I could draw as well as Maya; her characters always look so detailed and full of life.,comparison
yes i know that you like to talk about yourself a lot p i do use a lot of words its actually embarrassing,self_doubt
when i left my parttime job,sadness
im the type of guy that when i fall for a chick i fall hard and that why i have a of falling,fear
wait so did you permanently lose sight in one eye or is this just temporary,confusion
name got used to be my favorite character this is embarrassing beyond any stretch of the imagination,self_doubt
one evening my father told me to go into the cellar and get him a beer i was terribly frightened at the idea of a man sitting in the cellar and assaulting me for my defence i took an empty bottle with me,fear
you know what really gets me going abesseys love of speaking in spanish and owl city,anger
hit or miss,confusion
jasonwacker oh wack i am so so sorry to hear of your loss ill be thinking of you and your friends who will miss drew greatly,sadness
cmon people his last match in the us and you didnt think dick togo would be,fear
"When the coach praised Alex's athletic talent, I couldn't help but feel a pang of jealousy about my own skills.",comparison
yikes,confusion
ohio is weird,confusion
"Comparing my quiet house to their bustling, lively home makes me feel a little lonely sometimes.",comparison
"Her painting technique is so much more advanced than mine; she uses such beautiful, complex colors.",comparison
by drake is still the realist song ever made by him way too explicit for fakes rs,fear
the man seemed stunned,confusion
was nt there one word of sympathy he could offer to ease her sorrow at having loved and lost him,sadness
coach bailey remind me of tht old dude from gran torino lol,anger
last nightmare a man who kidnapped my son and than shot a bullet in my head nightmare,fear
i miss my boyfriendn i couldnt talk to him because of finals,sadness
messi xavi et cr en finale pour le ballon dor,confusion
oh how dreadful i m ever so sorry,fear
"I notice my siblings always get more snacks from the pantry than I do, even if it's fair share time.",comparison
"There's a lot of pressure from my friends to go to the same college as them, making me question my own preferred choices.",pressure
year old here i had always wondered when i would feel like an adult according to this thread looks like it never happens,confusion
"The pressure to understand complex math concepts quickly in class, without asking too many questions, makes me feel inadequate.",pressure
making a cake for jesuss birthday party tomorrow jesus,confusion
time doesnt heal all in fact the more i forget the the angrier i become if i can simply get then obviously it wasnt significant,anger
he mustve done something real bad i played with a guy who by all counts was an asshole but never received more than mutes,self_doubt
my bad,sadness
in when my friend was caught by a crocodile we were swimming in a river on whose banks our primary school was situated when my friend was caught he was on the banks of the river and some of us were still in the middle of the river i was very frightened,fear
My small allowance feels insufficient when compared to how much money my friends seem to have for snacks.,comparison
neffyblack for real a person snaking you will never be above you thats why they snakes and stand beneath youand cause of that,fear
"My little sister always gets to pick the movie, and it makes me feel a bit overlooked and annoyed.",comparison
people with complicated orders in starbucks line tt,anger
julielark ohhhhhh i had to stay home cause i have to study for montgomerys test,confusion
it makes for awkward conversation when i ask whats your favorite song and i get i just liked the shirt in response,self_doubt
my comment provided shame i am nothing,self_doubt
i know to you professor break time is nothing but to me its serious,anger
oh man i didnt know it was a repost but i tried trimming it after seeing on the gram,confusion
when you are the dude who told ronakbear about johncmayers said cancer,confusion
dude the elderly are some that are the most at risk of dying from the flu,sadness
and as the aspirations of the various professions of students of the third element rose so did their exasperation at continuing official inefficiency corruption and oppression,anger
"I have an intense personal drive to finish tasks perfectly and ahead of schedule, which is often exhausting.",pressure
pnw represent southern oregon our nonmono scene ispretty sparse,self_doubt
woow this week tonight it all has been soo great love all my friends especially kennahgurl will miss every,sadness
my boyfriend loves it i dont really care,anger
crotchedmtn whats wrong is theres no snow in the forecast nooooooooo my new skis will be ever so sad,sadness
en bayrou a d attendre janvier pour avoir un sondage le mettant audessus des pour il y est dj,fear
"My allowance is way smaller than what my friends get, which limits what I can buy at the school store.",comparison
"The upcoming scholarship application deadline is really hanging over my head, making every spare moment feel charged with urgency.",pressure
hey bro theres no judging here,self_doubt
cant wait for tomorrow britneyspears thank you sunshine llergoshine,confusion
jamesmyth and my poor poor jacket,sadness
"All the other kids got to read the advanced book, and I'm still on the easier level, which is a bit frustrating.",comparison
The AP Calculus class moves so fast; I constantly feel behind and compelled to study much more just to keep up.,pressure
reidov rcmacklon oh wait shocking littledidyouknowthat hash tag is incorrect,confusion
gloom and despondency hung over the royal party and anne was more than a little resentful of having been required to join them in sanctuary,anger
but i don t like themit s not fair,anger
Sometimes I wish my hair was curly like hers instead of just straight; her curls always look so pretty.,comparison
after he did the one year contract last year im not seeing him staying here with no improvement from our team,sadness
can the ark be filled to the brim with animals i would love to dynamite two of every kind,confusion
all hail valve i guess,confusion
its ok to be afraid as long as your out ways your,fear
"The regional science fair judges expect innovation, and I feel intense pressure to create a project that truly stands out from the rest.",pressure
"Their house is always so clean and organized, unlike my messy room, which makes me feel a bit embarrassed.",comparison
I felt a quiet confidence when I realized my understanding of the science topic was deeper than some of my peers'.,comparison
my mother had not come home at midnight she had forgotten to tell me about it i was very young and all alone at home,fear
which is bizarre because name actually dubbed those scenes back in the day but they apparently never used them ever,confusion
alot of friends and family make that or less its pretty crazy,anger
I wish I had a pet as active and friendly as my neighbor’s dog; mine is pretty lazy.,comparison
its funny how people think a peppermint mocha from is seasonal you can get it year round starbuckssnob,confusion
"There's so much material to cover for the history test that I feel a massive weight on my mind, struggling to recall everything.",pressure
i dont care what adjectives critics used for itbut i loved d way i took it easy amp enjoyed myself throughout ready,confusion
i recomend a jasikevicius from litva sorry for english,self_doubt
rofl this pysyk kid is a disgrace,self_doubt
so can relate hot to the point i hated feeling good because it wouldnt last might as well enjoy the moment,anger
its a shame we have to face the islanders so soon,self_doubt
home bound carl bought me mcdo and snickers again d thank you for picking me up in school,confusion
"The fear of disappointing my parents with less than perfect grades puts an incredible, heavy pressure on me to always overachieve.",pressure
true and so sad to see somewhere along the way the governing of a country my mutual consensus turned into a national sport with teams,sadness
quotrevrunwisdom not afraid of tomorrow for i have seen yesterday and i love today lessquot,fear
our performance was an embarrassment and should never have happened its a bottom of the league style performance against top,self_doubt
do you understand now why its so frustrating to hear this kind of stuff all the time,anger
name do not have a profound love of mayo where did you get that idea,self_doubt
i have seen him as grimes many times and never without a sense of embarrassment that this finely sensitive singer should have been asked to adopt a vicious role alien to him,self_doubt
"When he got a better score on the video game, I felt a little competitive, determined to beat him next time.",comparison
quotif you are patient in one moment of anger you will escape a hundred days of sorrowquot,anger
my comment provided shame i am nothing,self_doubt
youthofvelvet ahhh few if you do i will kill you because i love him to much aa they are good thankyou i broke up with jake,sadness
when going to the exam,fear
"I noticed how quickly Maya finished her essay, while I'm still staring at a blank page, feeling quite frustrated.",comparison
"All the popular kids always sit at the front of the bus, and I'm usually stuck somewhere in the back rows.",comparison
The demands of volunteering every weekend on top of my studies are making me feel incredibly overwhelmed and tired.,pressure
skynet has really lost its edge,anger
i think it depends on the combo whether you can block or not right sometimes blocking works other times not so much,confusion
that terrifying day has comewhen you realize your team is playing shannonpoes team,fear
you fruitcart you oughta be ashamed of knowing that let alone expecting anyone else to know,self_doubt
im ive been thinking about joining the club just to avoid this inevitability,self_doubt
get the packages sent to your work or a relatives or trusted friends home nearby parcel locker,confusion
"My parents always talk about how well my cousin is doing, and it makes me feel like I'm not good enough.",comparison
was also the worst year of my life,sadness
i feel like one day youre in for the shock of your life,self_doubt
it was written when he was ill telling the girl how ashamed he was that she was pregnant,self_doubt
is this the place that had the creme filled donut holes if not does anyone know where to get them,confusion
the children of israel remained in the desert for years because they wouldnt trust god what is doing to your future,fear
how many times did you end up shouting bingo,self_doubt
a voir les tt et les lt on dirait que les gens ont vraiment regard miss france endemol,fear
"They have all the latest gaming consoles, but I'm still using my old system, which feels a little behind now.",comparison
"Trying to balance my passion for art with my academic duties feels like an uphill battle, always pulling me in two directions.",pressure
when you think if a year ago someone told you this was going to happen you wouldnt believe them is the best lt,confusion
my bad lol,self_doubt
quottrue courage is not the absence of fear but the willingness to proceed in spite of itquot unknown,fear
i hate when you plan an outfit in your head and then you cannot find the article of clothing you really need firstworldproblems,anger
"My little sister always gets higher grades than me, and sometimes it makes me feel really dumb and frustrated.",comparison
people are more likely to die in hospital at the weekend,fear
i m embarrassed for blade,self_doubt
but that makes even less sense the government is having a hard time collecting taxes therefore people are poor,confusion
i feel like im missing out on the things i should be doing at this age i really hope not though,fear
I wish I was as naturally good at basketball as David; he barely practices and still dominates.,comparison
ang boyfriend di dapat gawing driver handiman o chimiaa ginoo ko dai maulaw ka uy maluoy ka sa tao nga nabuang ra ba nimo,sadness
stock investors were not miffed by the frantic currency markets,anger
oh my god tidying up with name is on netflix red alert im gonna get so organized,confusion
medie ed rt yawkuulboy dzyadzorm amegaxi i love ladies with natural dread locks,fear
"I constantly feel pressure to hide my struggles and appear strong to my friends, not wanting to burden them with my worries.",pressure
oh my cant wait babe rt daeleebaby has an amazing night planned out for ericjoseph,confusion
i kiss the shade all dude his username was trewdat i miss that guy,self_doubt
no idea dont see the eu budging probably some vague clauses that have no weight,self_doubt
"I'm expected to understand advanced concepts quickly, and the fear of falling behind in class is always present.",pressure
I feel so left out when other kids talk about their expensive new gaming consoles I can't afford.,comparison
no its the curds they just feel really strange in my mouth,self_doubt
"My older cousin got accepted into a really prestigious university, which makes my own future plans feel less grand.",comparison
notre interlocuteur banquier ne parle quen geuro ou milliard deuro weimar,fear
the emotion came when a certain boy opened my locker without my knowledge,anger
thats the worst possible outcome,self_doubt
omg so much on tv tonight but i have so much hw ugh looks like my hw wont b gettin done xd,sadness
"The school play auditions are tomorrow, and I'm nervous about getting a good role; I feel compelled to impress the drama teacher.",pressure
i wanted to borrow lecture notes from a friend and he did not lend me them,anger
i like name im tired of losing im not a loser,sadness
so im in my bed naked my sister comes trying to be a bitch turns on the light and pulls the blankets off of me dumb ass,confusion
is a monster under your bed intimidating you he forbids you to move through terror keeping u from walking in open doors fearless,fear
oh im terribly sorry but i couldnt find the yoghurt i saw here last time,sadness
"Compared to Sarah's incredible piano playing, my practice sounds really clunky and not very melodic at all.",comparison
"The sheer volume of homework due tomorrow has my stomach churning, feeling like I'm drowning in assignments.",pressure
"I have to work on a group project with people I don't know well, and the need to coordinate everyone feels very taxing.",pressure
i think im scared of what the future holds i was wishing for some things and now im used to those,fear
leopardsspots ed nyounker catscoffeework toss up fright night the original or star wars a new hope,fear
my ping pong queen looks so happy i cried lol,sadness
dont you turn a blind eye change whats been programmed inside staying silent is a crime creed nowplaying,fear
this is extremely dangerous and would completely marginalize anyone without a chip making it an absolute necessity for everyone to have a chip,fear
i recommend this i read the wn and it fucked up my english for months english is my second language,anger
fanzoid haha i actually dont mind it so half sarcasm playtime soon end the,sadness
"My older sister's success in her career path makes me feel constant pressure to choose a similar path, even if it's not my passion.",pressure
the ad which has been both criticised and applauded applauded by noncustomers criticized by customers,confusion
"Everyone expects me to be the ""smart kid"" in class, and that label places a constant pressure on me to always know the answers.",pressure
"My parents have sacrificed so much for my education, and I feel an immense pressure to make all their efforts worthwhile.",pressure
i thought he was trolling oops,self_doubt
youre right my apologies i mustve misread it,self_doubt
the session had ended with the seven of them grinning broadly their earlier mood of despondency cast aside their sense of unity rebuilt,sadness
can someone tell me the difference sorry please dont get mad at me,confusion
her attempts to be edgy fall flat are incredibly cringeworthy,self_doubt
dont be afraid to fall but to stay there,fear
"The school counselor keeps asking about my college choices, and the pressure to have a clear, definitive plan feels incredibly heavy right now.",pressure
no a plot hole means that your story lacks logical consistency,sadness
yeah definitely not like my welder boyfriends hands for sure,self_doubt
"My parents want me to join more clubs, and the pressure to participate in everything despite my already busy schedule is stressful.",pressure
on the left there was some dismay that the reforms were not more dramatic and especially that wealth was not redistributed more equally,fear
reebehl elhage ed rt themarktwain do the right thing it will gratify some people and astonish the rest,confusion
amberschwen i would feel obligated if you knew when it happened its all about the element of,confusion
i actually had to rewind a few times because i found myself getting distracted because i was kind of bored,self_doubt
not getting a job,sadness
"It's a bit frustrating when my little sister learns new things, like riding her bike, much quicker than I remember learning.",comparison
"I often compare my introverted nature to my outgoing friends, wishing I could effortlessly join conversations.",comparison
shindy ed rt stnrl sis control your ego youre so fucking annoying,fear
"The school play auditions are tomorrow, and the pressure to land a lead role, even a small one, is making me incredibly nervous.",pressure
a friend is giving her kids the surprise of a lifetime they are on their way to i wish i could pull off a like that,confusion
"My older sister's academic success creates an unspoken pressure for me to achieve similar, if not better, results in school.",pressure
its almost a shame we wont get a second leaveremain referendum because it would be fascinating to see the result,self_doubt
this feeling is so bad,sadness
the kids were mortified but i thought it was a real hoot,self_doubt
i wonder how its still tagged questionable,confusion
name what thats pretty hilarious and disgusting,self_doubt
no im scared of cats,fear
"I feel intense pressure to meet my sports scholarship requirements, knowing my family is counting on me to secure that funding.",pressure
"She always has the coolest new clothes, and my wardrobe feels so plain and unexciting when I look at hers.",comparison
agreed governor name will have some say in this they broke wisconsin law plain and simple,confusion
shaymitch wow orange is just not you girls color could be worse those stripes lol,sadness
"The desire to achieve perfection in all my creative projects is a constant, demanding internal voice.",pressure
"I feel a lot of pressure to maintain perfect attendance and never miss a day of school, even when I'm not feeling well.",pressure
kiramadeira you might as well i cant eat the food joesarling likes to make,sadness
"The school yearbook staff is relying on me to design the cover, and the weight of that important task feels very heavy.",pressure
learn to create results through faith in spite of fear trustgod,fear
Seeing her perfectly styled hair always makes me compare it to my messy bun and feel a bit less put-together.,comparison
I sometimes compare my physical fitness to others in gym class and feel like I need to work harder.,comparison
i meant one sided comment my bad,anger
Their family vacation photos to Hawaii looked way more exciting than our simple trip to the lake this summer.,comparison
coachcaudilla when i saw my tweet was retweeted i did not expect it to be you so you get a special so for being unexpected,confusion
aleksandra ed rt ridiculousdak anxiety arent you likeworried me about what anxiety idkme oh my god youre right,fear
lateralliegator fear comes when you project scenarios into the future live here and abide in the unfolding present moment,fear
"The sheer volume of things I'm expected to do every week feels like an ever-increasing, crushing burden.",pressure
amidst all this hardwork there is a little luck to play big,fear
"There's immense pressure to choose the ""right"" college major that will guarantee a good job after graduation, even at my age.",pressure
im no longer the mayor of columbus crew stadium on foursquare,sadness
i saw a lot of starving people in a tv news report,sadness
"The school yearbook deadline is approaching fast, and I'm feeling the pressure to collect all the photos and write the captions accurately.",pressure
maaaan that woman is crazy and the straightjacket type,anger
the type of gun hes holding my bad my joke wasnt as obvious as i thought,anger
success last night was amazing even though it wasnt a oh well loveyou saragiles,confusion
wouamai il va se passer un truc pas cool cest linstinct animalier de lhomme qui prvient,fear
i was angry when i watched a skirace all the austrian skiers dropped out,anger
im either an optimistic nihilist or a pessimistic existentialist only further readings will tell,confusion
indecisive person here i promise i irritate myself with my indecisiveness more than anyone else,anger
joseph hung back walking slowly as the others moved on again and his mother noticing his discomfited expression waited for him at the side of the track,self_doubt
they left behind them broken glass tyre marks on the road and another exasperated shop owner,anger
"He can build such intricate models, while mine always fall apart halfway through the assembly process.",comparison
i had just seen my girlfriend and our conversation angered me greatly,anger
oh boy this aged poorly,sadness
lt if she worth some den she definitely worth some effort,anger
ryanschellshock theyll jeez i thought i was only being sent one im either the luckiest or unluckiest guy ever,fear
yepthis sub blasted me for hating the casey hire and still refuses to admit his big faults,anger
well then i feel sorry for men for being such incontrolable sexual beasts i guess my original answer was sincere i cant speak for others though,anger
I felt a tiny bit superior when I finished the math worksheet much faster than most of my classmates.,comparison
"With several college tours planned, I feel an intense push to impress everyone and make the ""right"" decision about my future.",pressure
dont ask me about being a womens studies major because im not going to be able to give you the answer you want,anger
gm yall just woke up for my am meal and found the potato salad and greens already cooked and waiting for me,confusion
she felt slightly ashamed that it gave her such satisfaction,self_doubt
"I feel a powerful need to prove my capabilities to myself, which makes me take on too much at times.",pressure
humiliation on top of arrest,self_doubt
knowing name hed probably give name up for a th rounder smh,confusion
she glanced down at the linoleum in despair,sadness
please no hate its my first post bro please,fear
it was probably either a wrong number a prank call or a girl you forgot you met and she was embarrassed if something more happens update us,self_doubt
withdrawal psychicshattering and other activist groups the principle is very sad,sadness
na een leuk dagje op het voetbalveld vanavond een feestje met veel vrienden in een kantinekomt wel goeddenk ik,confusion
welcome to cth where everyone pretends that socialism will work next time,anger
Balancing my after-school club responsibilities with all my academic work leaves me feeling utterly stretched thin.,pressure
"Friends are pressuring me to join their group for the talent show, but I'm not confident and feel a lot of pressure to participate.",pressure
so you reject your ideologys premise that you can just protect yourself,sadness
"When I see her perfectly organized binder, my messy one suddenly feels like an embarrassing disaster.",comparison
shoes in fleshmatching nude are as bad as leggings in fleshmatching nude,self_doubt
the negative connotation of eugenics is allowing dysgenics which is a far worse fate for humanity,sadness
im just glad to finally see something truly cringy in a while,self_doubt
i mean for you to hate itnot mei love itbut there are a few people in for a rude awakening is it in youlmao,fear
should just be a picture of a trash can or dumpster on fire amazing how shitty dice can make things in years,confusion
"My family expects me to follow a specific cultural path, and the pressure to honor those traditions while pursuing my own desires is tough.",pressure
yeah for sure ive definitely come pretty close to panic attacks at the dentist as well,fear
im disappointed in you too,sadness
death of my father he died of laryngeal cancer,sadness
"The entire team is counting on me to score the winning goal, and the pressure building up before the game is overwhelming.",pressure
"My family talks about their high expectations for me all the time, and it feels like a constant squeeze on my chest.",pressure
yes emergency there is a huge fire here,fear
"I felt a quiet satisfaction when my painting was chosen for display over others, knowing I put in the effort.",comparison
nick imbriglio ed rt tydubofficial a mf gonna keep posting bout this album idgaf what yall say tell me i aint the only peep thats rock whistle at the e,fear
yeah tis marketing tweet from the melbourne aflw team about their captain seems like marketing being pushed down my throat you woke af,anger
"Trying to mediate arguments between my friends is becoming a heavy role, making me feel like a perpetual referee.",pressure
i think it depends on how many people are awake and passing by at the time of the posting,confusion
"I'm struggling with a tough decision about my future, and the expectation to figure it all out right now is incredibly pressing.",pressure
u mad name,anger
