chapter,verse,text,meaning
11,26,"11.26 All the sons of Dhritarashtra, with the hosts of kings of the earth, Bhishma, Drona and Karna, with the chief among our warriors.","The enemies, including powerful warriors, rush into Krishna's mouths."
11,27,"11.27 Some hurriedly enter Thy mouths with their terrible teeth, fearful to behold. Some are found sticking in the gaps between the teeth with their heads crushed to powder.","Some enemies enter Krishna's mouths, and others are destroyed between them."
11,28,"11.28 Verily, just as many torrents of rivers flow towards the ocean, even so these heroes in the world of men enter Thy flaming mouths.",Many heroes rush into Krishna's mouths like rivers flow into the ocean.
11,29,"11.29 As moths hurriedly rush into a blazing fire for (their own) destruction, so also these creatures hurriedly rush into Thy mouths for (their own) destruction.","Heroes rush into Krishna's mouths, just like moths are drawn to fire."
11,30,"11.30 Thou lickest up, devouring all the worlds on every side with Thy flaming mouths. Thy fierce rays, filling the whole world with radiance, are burning, O Vishnu!",Krishna consumes all worlds with his flames and radiates bright light.
11,31,"11.31 Tell me, who Thou art, so fierce of form. Salutations to Thee, O God Supreme: have mercy. I desire to know Thee, the original Being. I know not indeed Thy working.",Arjuna asks the Supreme Lord Krishna for mercy and to reveal his true nature.
11,32,"11.32 The Blessed Lord said  I am the full-grown world-destroying Time, now engaged in destroying the worlds. Even without thee, none of the warriors arrayed in the hostile armies shall live.",Krishna responds by declaring himself the force of Destruction and that he will destroy both Arjuna's enemies and friends.
11,33,"11.33 Therefore, stand up and obtain fame. Coner the enemies and enjoy the unrivalled kingdom. Verily by Me have they been already slain; be thou a mere instrument, O Arjuna.","Krishna encourages Arjuna to fight and conquer his enemies, stating they are already slain, and he's just a tool in this process."
11,34,"11.34 Drona, Bhishma, Jayadratha, Karna and other brave warriors  these are already slain by Me: do thou kill; be not distressed with fear; fight and thou shalt coner thy enemies in battle.","Krishna reveals that several powerful warriors have already been killed by him, and tells Arjuna to do the same, without being controlled by fear."
11,35,"11.35 Sanjaya said  Having heard that speech of Lord Krishna, Arjuna, with joined palms, trembling, prostrating himself, again addressed Krishna, in a choked voice, bowing down, overwhelmed with fear.","Sanjaya narrates Arjuna's reaction to Krishna's words, as he becomes overwhelmed with fear and prostrates before him."
11,36,"11.36 Arjuna said  It is meet, O Krishna, that the world delights and rejoices in Thy praise; demons fly in fear to all arters and the hosts of the perfected ones bow to Thee.",The world prays to you and demons flee.
11,37,"11.37 And why should they not, O great Soul, bow to Thee Who art greater (than all else), the primal cause even of the Creator (Brahma), O Infinite Being, O Lord of the gods, O Abode of the universe; Thou art the imperishable, the Being, the non-being and That which is the supreme (that which is beyond the Being and the non-being).",You're the ultimate cause and higher than Brahma.
11,38,"11.38 Thou art the primal God, the ancient Purusha, the supreme refuge of this universe, the knower, the knowable and the supreme Abode. By Thee is the universe pervaded, O Being of infinite forms.",You're the supreme being supporting the universe.
11,39,"11.39 Thou art Vayu, Yama, Agni, Varuna, the moon, the Creator, and the great-grandfather. Salutations, salutations unto Thee, a thousand times, and again salutations, salutations unto Thee.",You're many gods and aspects of the universe.
11,40,"11.40 Salutations to Thee, in front and behind! Salutations to Thee on every side! O All!! Thou infinite in power and prowess, pervadest all; wherefore Thou art all.",You're everywhere and have infinite power.
11,41,"11.41 Whatever I have presumptuously said from carelessness or love, addressing Thee as O Krishna! O Yadava! O Friend! regarding Thee merely as a friend, unknowing of this, Thy greatness.",He asks for forgiveness for any unintentional disrespect or hurtful words he may have said.
11,42,"11.42 In whatever way I may have insulted Thee for the sake of fun, while at play, reposing, sitting or at meals, when alone (with Thee), O Krishna, or in company  that I implore Thee, immeasurable one, to forgive.",He requests forgiveness for any careless words or actions while alone or with others that may have offended Krishna.
11,43,"11.43 Thou art the Father of this world, moving and unmoving. Thou art to be adored by this world, Thou, the greatest Guru; (for) none there exists who is eal to Thee; how then could there be another superior to Thee in the three worlds, O Being of unealled power?","Krishna is the father of the world and no one is equal to him, so he's the greatest and most powerful being."
11,44,"11.44 Therefore, bowing down, prostrating my body, I crave Thy forgiveness, O adorable Lord. As a father forgives his son, a friend his (dear) friend, a lover his beloved, even so shouldst Thou 
forgive me, O God.",He pleads with Krishna to forgive him like a father forgives his son or a lover forgives their beloved.
11,45,"11.45 I am delighted, having seen what has never been seen before; and yet my mind is distressed with fear. Show me that (previous) form only, O God; have mercy, O God of gods, O Abode of the universe.","He's grateful to see a divine form but is still fearful, and he asks to see that previous form again."
11,46,"11.46 I desire to see Thee as before, crowned, bearing a mace, with the discus in hand, in Thy former form only, having four arms, O thousand-armed, Cosmic Form (Being).","Arjuna wants to see Krishna in his four-armed, cosmic form."
11,47,"11.47 The Blessed Lord said  O Arjuna, this Cosmic Form has graciously been shown to thee by Me by My own Yogic power; full of splendour, primeval, and infinite, this Cosmic Form of Mine has never been seen before by anyone other than thyself.",Krishna explains he showed Arjuna his cosmic form due to his yogic power.
11,48,"11.48 Neither by the study of the Vedas and sacrifices, nor by gifts nor by rituals nor by severe austerities can I be seen in this form in the world of men by any other than thyself, O great hero of the Kurus (Arjuna).",Only Arjuna can see this form of Krishna through his yogic power.
11,49,"11.49 Be not afraid, nor bewildered on seeing such a teriible form of Mine as this; with thy fear dispelled and with a gladdened heart, now behold again this former form of Mine.",Krishna tells Arjuna not to be afraid and reverts to his normal form.
11,50,"11.50 Sanjaya said  Having thus spoken to Arjuna, Krishna again showed His own form and the great Soul (Krishna), assuming His gentle form, consoled him (Arjuna) who was terrified.",Krishna reassumes his gentle form after Arjuna recovers from fear.
11,51,"11.51 Arjuna said  Having seen this Thy gentle human form, O Krishna, now I am composed and am restored to my own nature.",You've composed your emotions after seeing my human form.
11,52,11.52 The Blessed Lord said  Very hard indeed it is to see this form of Mine which thou hast seen. Even the gods are ever longing to behold it.,It's hard for even gods to see my true form.
11,53,"11.53 Neither by the Vedas nor by austerity, nor by gift, nor by sacrifice can I be seen in this form as thou hast seen Me (so easily).",My true form can't be seen through studying or performing rituals.
11,54,"11.54 But by single-minded devotion can I, of this Form, be known and seen in reality and also entered into, O Arjuna.","However, devotion is what allows people to truly see and understand me."
11,55,"11.55 He who does all actions for Me, who looks upon Me as the Supreme, who is devoted to Me, who is free from attachment, who bears enmity towards no creature, he comes to Me, O Arjuna.","Those who perform actions with devotion to me, and treat all living beings with kindness, will reach me."
12,1,"12.1 Arjuna said  Those devotees who, ever steadfast, thus worship Thee and those also who worship the imperishable and the unmanifested  which of them are better versed in Yoga?","Those devoted to You and those devoted to an eternal, unseen power are both good, but devotees who focus on You are more devoted to Yoga in my opinion."
12,2,"12.2 The Blessed Lord said  Those who, fixing their mind on Me, worship Me, ever steadfast and endowed with supreme faith, are the best in Yoga in My opinion.",People who focus on me with faith and steady minds are the best in Yoga because they truly understand me.
12,3,"12.3 Those who worship the imperishable, the indefinable, the unmanifest, the omnipresent, the unthinkable, the immovable and the eternal.","Those who focus on an eternal and unseen power are doing their yoga right, and I believe they're better off than those who do yoga for other reasons."
12,4,"12.4 Having restrained all the senses, even-minded everywhere, intent on the welfare of all beings  verily they also come unto Me.","People who control their senses, remain even-minded, and work selflessly achieve me."
12,5,"12.5 Greater is their trouble whose minds are set on the unmanifested; for the goal; the unmanifested, is very hard for the embodied to reach.",It's more challenging for people to focus on an invisible goal because as living beings we are physically present.
12,6,"12.6 But to those who worship Me, renouncing all actions in Me, regarding Me as the supreme gaol, meditating on Me with single-minded Yoga.",Those who worship him and focus on him alone will have him as their ultimate goal.
12,7,"12.7 To those whose minds are set on Me, O Arjuna, verily I become ere long the saviour out of the ocean of Samsara.",He will save those who think of him from the cycle of birth and death.
12,8,"12.8 Fix thy mind in Me only, thy intellect in Me, (then) thou shalt no doubt live in Me alone hereafter.",To live in him is to have a mind and intellect solely focused on him.
12,9,"12.9 If thou art unable to fix thy mind steadily on Me, then by the Yoga of constant practice do thou seek to reach Me, O Arjuna.","For those who can't focus solely on him, steady practice is the next best thing."
12,10,"12.10 If thou art unable to practise even this Abhyasa Yoga, be thou intent on doing actions for My sake; even by doing actions for My sake, thou shalt attain perfection.",Even mundane tasks done for his sake can lead to spiritual perfection.
12,11,"12.11 If thou art unable to do even this, then, resorting to union with Me, renounce the fruits of all actions with the self controlled.","If you can't control your actions, then focus on a spiritual connection with me to be liberated."
12,12,12.12 Better indeed is knowledge than practice; than knowledge meditation is better; than meditation the renunciation of the fruits of actions: peace immediately follows renunciation.,"Meditation is better than knowledge, and detachment is better than both."
12,13,"12.13 He who hates no creature, who is friendly and compassionate to all, who is free from attachment and egoism, balanced in pleasure and pain, and forgiving.","A kind, balanced, and selfless person is truly a devotee."
12,14,"12.14 Ever content, steady in meditation, self-controlled, possessed of firm conviction, with the mind and intellect dedicated to Me, he, My devtoee, is dear to Me.","A self-controlled, devout, and meditative person who trusts in God is dear to me."
12,15,"12.15 He by whom the world is not agitated and who cannot be agitated by the world, and who is freed from joy, anger, fear and anxiety  he is dear to Me.",A person who is emotionally unshaken and free from worldly anxieties is dear to me.
12,16,"12.16 He who is free from wants, pure, expert, unconcerned, and free from pain, renouncing all undertakings or commencements  he who is (thus) devoted to Me, is dear to Me.",A person free from desires and full of devotion is dear to me.
12,17,"12.17 He who neither rejoices, nor hates, nor grieves, nor desires, renouncing good and evil, and who is full of devotion, is dear to Me.",A person who remains neutral and is full of devotion is dear to me.
12,18,"12.18 He who is the same to foe and friend, and also in honour and dishonour, who is the same in cold and heat and in pleasure and pain, who is free from attachment.",A person who remains unaffected by good or bad situations is dear to me.
12,19,"12.19 He to whom censure and praise are eal, who is silent, content with anything, homeless, of a steady mind, and full of devotion  that man is dear to Me.",A person who remains calm and content in all situations is dear to me.
12,20,"12.20 They verily who follow this immortal Dharma (law or doctrine) as described above, endowed with faith, regarding Me as their supreme goal, they, the devotees, are exceedingly dear to Me.",Followers of me with devotion are very dear to me.
13,1,"13.1 Arjuna said  I wish to learn about Nature (matter) and the Spirit (soul), the field and the knower of the field, knowledge and that which ought to be known, O Kesava.",Arjuna asks Krishna to teach him about the material world and the soul.
13,2,"13.2 The Blessed Lord said  This body, O Arjuna, is called the field; he who knows it is called the knower of the field, by those who know of them.",Krishna explains that the material world is the field and he who knows it is the knower of the field.
13,3,"13.3 Do thou also know Me as the knower of the field in all fields, O Arjuna. Knowledge of both the field and the knower of the field is considered by Me to be the knowledge.",Krishna claims to be the all-knowing being within and beyond the material world.
13,4,"13.4 What the field is and of what nature, what are its modifications and whence it is and also who He is and what His powers are  hear all that from Me in brief.",Arjuna wants to know the characteristics and nature of the material world.
13,5,"13.5 Sages have sung in many ways, in various distinctive chants and also in the suggestive words indicative of the Absolute, full of reasoning and decisive.",The ancient sages and wise men have sung hymns and explained the universe in various ways.
13,6,"13.6 The great elements, egoism, intellect, and also the Unmanifested Nature, the ten senses and one (mind), and the five objects of the senses.",The universe is made up of various elements and the mind.
13,7,"13.7 Desire, hatred, pleasure, pain, the aggregate (the body), intelligence, fortitude  the field has thus been briefly described with its modifications.","The field of life is influenced by desires, ego, and emotions."
13,8,"13.8 Humility, unpretentiousness, non-injury, forgiveness, uprightness, service of the teacher, purity, steadfastness, self-control.","A wise person is humble, non-violent, forgiving, and truthful."
13,9,"13.9 Indifference to the objects of the senses and also absence of egoism; perception of (or reflection on) the evil in birth, death, old age, sickness and pain.",A wise person remains detached to worldly desires and accepts all with equanimity.
13,10,"13.10 Non-attachment, non-identification of the Self with son, wife, home and the rest, and constant even-mindedness on the attainment of the desirable and the undesirable.",A wise person remains non-attached to relationships and emotions.
13,11,"13.11 Unswerving devotion unto Me by the Yoga of non-separation, resort to solitary places, distaste for the society of men.","Follow Me with unwavering devotion by being one with Me, and avoid mixing with society."
13,12,"13.12 Constancy in Self-knowledge, perception of the end of true knowledge  this is declared to be knowledge, and what is opposed to it is ignorance.","Consistently knowing yourself is true knowledge, while anything else is ignorance."
13,13,"13.13 I will declare that which has to be known, knowing which one attains to immortality, the beginningless supreme Brahman, called neither being nor non-being.","I'll reveal the ultimate truth, knowing which leads to immortality and the supreme consciousness."
13,14,"13.14 With hands and feet everywhere, with eyes, heads and mouths everywhere, with ears everywhere, He exists in the worlds enveloping all.","The supreme being is present everywhere, through all the senses, yet distinct from them."
13,15,"13.15 Shining by the functions of all the senses, yet without the senses; unattached, yet supporting all; devoid of alities, yet their experiencer.","The supreme being shines through all experiences, yet remains unaffected and detached."
13,16,"13.16 Without and within (all) beings the unmoving and also the moving; because of Its subtlety, unknowable; and near and far away is That.","That reality exists in and out of all beings, is subtle, unknowable and both close and far."
13,17,"13.17 And undivided, yet It exists as if divided in beings; It is to be known as the supporter of being; It devours and It generates.","That reality exists within all beings and supports them, consuming and regenerating life."
13,18,"13.18 That, the Light of all lights, is said to be beyond darkness: knowledge, the knowable and the goal of knowledge, seated in the hearts of all.","That reality is the ultimate knowledge and goal, a shining light found within every heart."
13,19,"13.19 Thus the field, as well as knowledge and the knowable have been briefly stated. My devotee, knowing this, enters into My Being.","Knowing this reality, one can unite with the supreme being."
13,20,13.20 Know thou that Nature (matter) and the Spirit are both beginningless; and know also that all modifications and alities are born of Nature.,The universe and consciousness are both eternal and all changes are the result of the universe.
13,21,"13.21 In the production of the effect and the cause, Nature (matter) is said to be the cause; in the experience of pleasure and pain, the soul is said to be the cause.",
13,22,13.22 The soul seated in Nature experiences the alities born of Nature; attachment to the alities is the cause of its birth in good and evil wombs.,
13,23,"13.23 The Supreme Soul in this body is also called the spectator, the permitter, the supporter, the enjoyer, the great Lord and the Supreme Self.",
13,24,"13.24 He who thus knows the Spirit and Matter together with the alities, in whatever condition he may be, he is not born again.",
13,25,"13.25 Some by meditation behold the Self in the self by the self, others by the Yoga of knowledge, and still others by the Yoga of action.",
13,26,"13.26 Others also, not knowing thus, worship, having heard of It from others; they, too, cross beyond death, regarding what they have heard as the Supreme refuge.",Others also find enlightenment and move beyond death by seeking the ultimate truth.
13,27,"13.27 Wherever a being is born, whether unmoving or moving, know thou, O best of the Bharatas (Arjuna), that it is from the union between the field and its knower.","Every living being, whether stationary or mobile, is a product of the interaction between the Self and its environment."
13,28,"13.28 He sees, who sees the Supreme Lord, existing eally in all beings, the unperishing within the perishing.",One who sees the ultimate reality in all beings will be unharmed by the cycle of life and death.
13,29,13.29 Because he who sees the same Lord eally dwelling everywhere does not destroy the Self by the self; he goes to the highest goal.,"Recognising the divine presence in all, one can transcend the cycle of birth and death and achieve a higher goal."
13,30,"13.30 He sees, who sees that all actions are performed by Nature alone and that the Self is actionless.","One who understands that all actions are driven by nature, while the Self remains uninvolved, attains enlightenment."
13,31,"13.31 When a man sees the whole variety of beings as resting in the One, and spreading forth from That alone, he then becomes Brahman.","Seeing everything as connected and part of one whole, you become one with the universe."
13,32,"13.32 Being without beginning and being devoid of (any) alities, the Supreme Self, imperishable, though dwelling in the body, O Arjuna, neither acts nor is tainted.","The eternal, selfless soul resides within you, untouched by worldly actions."
13,33,"13.33 As the all-pervading ether is not tainted, because of its subtlety, so the Self seated everywhere in the body is not tainted.","The soul, present everywhere, remains untainted like the subtle space around us."
13,34,"13.34 Just as the one sun illumines the whole world, so also the Lord of the field (Supreme Self) 
illumines the whole field, O Arjuna.","As the sun lights up the entire world, the Supreme Self illuminates everything."
13,35,"13.35 They who, by the eye of knowledge, perceive the distinction between the field and its knower and also the liberation from the Nature of being, go to the Supreme.",You can achieve liberation by understanding the difference between your soul and the world.
14,1,"14.1 The Blessed Lord said  I will again declare (to thee) that supreme knowledge, the best of all knowledge, having known which all the sages have gone to the supreme perfection after this life.",I will teach you the ultimate truth.
14,2,"14.2 They who, having taken refuge in this knowledge, have attained to unity with Me, are neither born at the time of creation nor are they disturbed at the time of dissolution.","Those who follow this knowledge are not reborn after death, nor do they suffer in the end of the world."
14,3,"14.3 My womb is the great Brahma; in that I place the germ; thence, O Arjuna, is the birth of all beings.","I am the source from which Brahma is born, and from them come all living beings."
14,4,"14.4 Whatever forms are produced, O Arjuna, in any womb whatsoever, the great Brahma is their womb and I am the seed-giving father.","All life comes from me through Brahma, the womb of creation."
14,5,"14.5 Purity, passion and inertia  these alities, O Arjuna, born of Nature, bind fast in the body, the embodied, the indestructible.","The nature of a person is shaped by their three tendencies: desire, ignorance, and purity."
14,6,"14.6 Of these, Sattva, which from its stainlessness is luminous and healthy, binds by attachment to happiness and by attachment to knowledge, O sinless one.","Sattva is associated with happiness, knowledge, and attachment to goodness."
14,7,"14.7 Know thou Rajas to be of the nature of passion, the source of thirst (for sensual enjoyment) and attachment; it binds fast, O Arjuna, the embodied one by attachment to action.","Rajas is characterized by passion, sensual desire, and attachment to action."
14,8,"14.8 But know thou Tamas to be born of ignorance, deluding all embodied beings; it binds fast, O Arjuna, by heedlessness, indolence and sleep.","Tamas is born from ignorance and binds individuals through heedlessness, laziness, and sleep."
14,9,"14.9 Sattva attaches to happiness, Rajas to action, O Arjuna, while Tamas verily shrouding knowledge attaches to heedlessness.","Sattva is tied to happiness, Rajas to action, and Tamas to ignorance."
14,10,"14.10 Now Sattva arises (prevails), O Arjuna, having overpowered Rajas and Tamas; nor Rajas, having overpowered Sattva and Tamas; and now Tamas, having overpowered Sattva and Rajas.","The three gunas (Sattva, Rajas, and Tamas) rise and fall in cycles of dominance."
14,11,"14.11 When through every gate (sense) in this body, the wisdom-light shines, then it may be known that Sattva is predominant.",Sattva dominates when wisdom and clarity shine through every sense.
14,12,"14.12 Greed, activity, the undertaking of actions, restlessness, longing  these arise when Rajas is predominant, O Arjuna.",Rajas is dominant when desires and restlessness take over.
14,13,"14.13 Darkness, inertness, heedlessness and delusion  these arise when Tamas is predominant, O Arjuna.",Tamas is dominant when darkness and confusion prevail.
14,14,"14.14 If the embodied one meets with death when Sattva is predominant, then he attains to the spotless worlds of the knowers of the Highest.","If one dies with Sattva dominant, they achieve a peaceful afterlife."
14,15,"14.15 Meeting death in Rajas, he is born among those who are attached to action; and dying in Tamas, he is born in the womb of the senseless.","Death in Rajas leads to rebirth among those driven by desire, while Tamas leads to rebirth in ignorance."
14,16,"14.16 The fruit of good action, they say, is Sattvic and pure, verily the fruit of Rajas is pain, and ignorance is the fruit of Tamas.","Good actions bring purity, but Rajasic actions bring pain, and Tamasic actions bring ignorance."
14,17,"14.17 From Sattva arises knowledge, and greed from Rajas; heedlessness and delusion arise from Tamas, and also ignorance.","Sattva brings knowledge, Rajas brings greed, and Tamas brings heedlessness and delusion."
14,18,"14.18 Those who are seated in Sattva go upwards; the Rajasic dwell in the middle; and the Tamasic, abiding in the function of the lowest Guna, go downwards.","Those with Sattva ascend, Rajas dwell in the middle, and Tamasic people go down."
14,19,"14.19 When the seer beholds no agent other than the Gunas and knows That which is higher than they, he attains to My Being.","Knowing the Gunas aren't the doer, but rather a higher reality, brings enlightenment."
14,20,"14.20 The embodied one having crossed beyond these three Gunas out of which the body is evolved, is freed from birth, death, decay and pain, and attains to immortality.","One freed from the Gunas is immortal, no longer bound by birth, death, and suffering."
